id,nev,cel,belepesi_pont,auth_szukseges,fo_interakciok,adatforrasok,validaciok,kezelt_allapotok,a11y
S01,Főoldal,Nyilvános landing oldal: bemutatja a ParkVision rendszert és az elérhető bevásárlóközpontokat interaktív térképpel és kártyákkal.,"induló (böngésző / PWA ikon)",nem,"'Bejelentkezés' gomb → /login; Nyelv váltó (EN/HU); Téma váltó (light/dark/auto); Bevásárlóközpont kártyák böngészése; Interaktív térkép preview","GET /api/shopping-centers (ShoppingCenterCard-ok)",nincs (nincs form),loading / success,"Téma váltó aria-label; Nyelv váltó aria-label; PWA Install Snackbar: role=alert; Reszponzív grid (xs/sm/md/lg)"
S02,Bejelentkezés,Admin hitelesítés: email + jelszó bevitelével belépés a védett admin területre.,S01 ('Bejelentkezés' gomb),nem,"Email TextField; Jelszó TextField (password type); 'Bejelentkezés' submit gomb; Helytelen hitelesítési adatok esetén hibaüzenet","AuthContext.login() – MSW: POST /api/auth/login","Email: kötelező; Jelszó: kötelező; Helytelen adatok: hibaüzenet a form alatt",loading / error / success,"TextField-ek label-lel; Hibaüzenet role=alert; Enter billentyű form submit"
S03,Vezérlőpult,Összesített parkolási statisztikák áttekintése: bevásárlóközpontok száma + kapacitás + foglaltság + kihasználtság.,"S02 (sikeres login); Sidebar 'Dashboard'",igen,"Sidebar navigáció; AppBar: nyelv váltó; téma váltó; user menü (logout); Csak olvasható StatCard-ok","GET /api/shopping-centers → useShoppingCenters()\nAggregált számítások: totalCapacity / totalOccupied / totalFree / averageOccupancy",nincs (nincs form),loading / error / empty / success,"aria-live='polite' loading állapotban; ErrorBanner: role='alert'; EmptyState: role='status'; StatCard-ok: aria-label az értékekhez; Sidebar: aria-current='page'"
S04,Bevásárlóközpontok,Összes bevásárlóközpont táblázatos listája kihasználtság-szűrővel és egyéni térképes navigációval.,Sidebar 'Shopping Centers',igen,"Kihasználtság szűrő dropdown (Összes / Alacsony <50% / Közepes 50–80% / Magas ≥80%); 'View on Map' ikon gomb soronként → S05; Táblázat görgetés; AppBar akciók","GET /api/shopping-centers → useShoppingCenters()\nClient-side szűrés useMemo-val","Szűrő: csak előre definiált értékek (Select); nincs szabad bevitel",loading / error / empty / success,"Táblázat: role='table'; TableHead: scope='col'; Szűrő Select: aria-label; 'View on Map': aria-label tooltip; ErrorBanner: role='alert'; EmptyState: role='status'"
S05,Térkép,Interaktív térkép (OpenStreetMap / Leaflet) az összes parkolóterület helyzetével; keresés + saját helyzet meghatározás + Google Maps navigáció.,,"Sidebar 'Map'; S04 'View on Map' gomb",igen,"Keresőmező (real-time client szűrés); 'Saját helyzet' gomb → geolocation API; Marker kattintás → terület detail kártya; 'Navigate' gomb → Google Maps (új tab); Térkép zoom / pan (Leaflet natív)","GET /api/areas → useAreas()\nClient-side keresés useMemo-val\nnominator.geolocation API","Keresőmező: üres → összes marker látszik; geolocation: böngésző engedély kérés",loading / error / success,"Keresőmező: aria-label; 'My Location' gomb: aria-label; Marker popup: fokuszálható; Leaflet: billentyű navigáció korlátozott"
S06,Admin Panel,Fejlett analitikai dashboard: foglaltsági trendek (24h) + kapacitás összehasonlítás + megoszlás diagram + részletes táblázat.,Sidebar 'Admin Panel',igen,"Tab navigáció (Occupancy Trends / Capacity Analysis / Distribution); Refresh gomb → useAreas() refetch; Recharts interaktív grafikonok (hover tooltip); Táblázat görgetés","GET /api/areas → useAreas()\ngenerateOccupancyHistory() (mock idősor)",nincs (nincs form),loading / success,"Tab-ok: role='tab' / aria-selected; Refresh: aria-label; Grafikonok: korlátozott screen reader támogatás (Recharts)"
S07,Parkolóhelyek,Egyedi parkolóhelyek táblázata állapot-szűrővel (max 20 sor); foglalt / szabad státusz és frissítési idő megjelenítése.,Közvetlen URL (nincs aktív sidebar link),igen,"Állapot szűrő dropdown (Összes / Csak foglalt / Csak szabad); Táblázat megtekintése (read-only); AppBar akciók","GET /api/parking-spaces → useParkingSpaces()\nClient-side szűrés\nformatDistanceToNow(updatedAt)",nincs (nincs form),loading / error / empty / success,"ErrorBanner: role='alert'; EmptyState: role='status'; Táblázat: role='table'; Szűrő Select: aria-label"
S08,Területek,Parkolóterületek kártya-rácsos nézete foglaltsági progress bar-ral és állapot chip-pel.,Közvetlen URL (nincs aktív sidebar link),igen,"Területkártyák böngészése (read-only); Foglaltsági progress bar (zöld/narancs/piros); Állapot chip (aktív/inaktív); AppBar akciók","GET /api/areas → useAreas()\nKihasználtság % számítás",nincs (nincs form),loading / error / empty / success,"ErrorBanner: role='alert'; EmptyState: role='status' + 'Create Area' gomb (disabled); Chip-ek: aria-label a státuszhoz"
